{
  "contract": "viewer_projection_v1",
  "format_version": 1,
  "projection_id": "projection-20260718-01",
  "product_snapshot_id": "product-20260718-01",
  "candidate_snapshot_id": "candidate-20260718-01",
  "projection_version": "ariadne-view-1.0.0",
  "settings_sha256": "6666666666666666666666666666666666666666666666666666666666666666",
  "projection": {
    "storage_ref": "viewer/data/projection-20260718-01.json",
    "sha256": "7777777777777777777777777777777777777777777777777777777777777777",
    "byte_length": 2097152,
    "media_type": "application/json"
  },
  "edge_semantics": {
    "human_type": "human_assertion",
    "derived_types": [
      "derived_chronological",
      "derived_similarity",
      "research_suggestion"
    ]
  },
  "generated_at": "2026-07-18T05:30:00Z"
}
